{
  "schema_id": "crossframe.ultra.v8.2.route-map",
  "schema_version": 1,
  "framework_version": "v8.2",
  "framework_revision": "v8.2",
  "raw_sha256": "608a4e4099b18c96c18ed3c92a2ab5cdacbd737daca4214c77debdd795da3a20",
  "semantic_sha256": "4b63a6455cf73c136ae18d124aeed4301267fd2da78cca79c74e2850fb2728b0",
  "route_count": 9,
  "routes": [
    {
      "route_id": "V82-ROUTE-AGGREGATION",
      "task": "审计单位到总体的分区聚合、异质性与成员处置上限。",
      "source_anchors": [
        "V82-P0936"
      ],
      "concept_ids": [
        "V82-M01"
      ],
      "contract_ids": [
        "V82-CONTRACT-CORE-KERNEL",
        "V82-CONTRACT-TRANSFORMATION"
      ]
    },
    {
      "route_id": "V82-ROUTE-CIRCLE-NESTING",
      "task": "默认：descriptive_nesting；描述性嵌套只检验边界、成员、重叠、退出和接口映射。后面三支：cross_layer_causal、object_conversion、intervention_conversion；跨层因果必须链接预注册 G4a 或 G4b root-instance，并通过 CAUSAL 与三态/null 门。圈层关系 Rcc；六类关系是封闭的静态描述词。嵌套表示一个圈层的成员、合同或运行位置被另一个圈层部分或全部包含；必须说明包含的基准。框架不要求每个节点只有一个父节点；每条边只表达一种已声明关系。",
      "source_anchors": [
        "V82-P0938",
        "V82-P0939",
        "V82-P0940",
        "V82-P0941",
        "V82-P0942",
        "V82-P1766",
        "V82-P1796",
        "V82-P1800",
        "V82-P1840"
      ],
      "concept_ids": [
        "V82-M02"
      ],
      "contract_ids": [
        "V82-CONTRACT-TRANSFORMATION",
        "V82-CONTRACT-WORLD-VOLUME"
      ]
    },
    {
      "route_id": "V82-ROUTE-NETWORK-PROPAGATION",
      "task": "追踪跨圈层网络传播的路径、时延、损耗、替代路径与递归分支。",
      "source_anchors": [
        "V82-P0943",
        "V82-P0944",
        "V82-P2117",
        "V82-P2118",
        "V82-P2120"
      ],
      "concept_ids": [
        "V82-M03"
      ],
      "contract_ids": [
        "V82-CONTRACT-TRANSFORMATION",
        "V82-CONTRACT-WORLD-VOLUME",
        "V82-CONTRACT-RECURSIVE-INFERENCE"
      ]
    },
    {
      "route_id": "V82-ROUTE-TEMPORAL-ACCUMULATION",
      "task": "在冻结窗口内比较累积、衰减、恢复规则与历史增量边界。",
      "source_anchors": [
        "V82-P0945",
        "V82-P0946"
      ],
      "concept_ids": [
        "V82-M04"
      ],
      "contract_ids": [
        "V82-CONTRACT-TRANSFORMATION",
        "V82-CONTRACT-RECURSIVE-INFERENCE"
      ]
    },
    {
      "route_id": "V82-ROUTE-INSTITUTIONALIZATION",
      "task": "区分制度事实、法律有效、规范正当、保护与继续授权。",
      "source_anchors": [
        "V82-P0948",
        "V82-P0949"
      ],
      "concept_ids": [
        "V82-M05"
      ],
      "contract_ids": [
        "V82-CONTRACT-TRANSFORMATION",
        "V82-CONTRACT-JUDGMENT-GOVERNANCE"
      ]
    },
    {
      "route_id": "V82-ROUTE-EMERGENCE",
      "task": "比较互动生成目标模式与简单加和模型，并隔离下行因果。",
      "source_anchors": [
        "V82-P0950",
        "V82-P0951"
      ],
      "concept_ids": [
        "V82-M06"
      ],
      "contract_ids": [
        "V82-CONTRACT-TRANSFORMATION",
        "V82-CONTRACT-RECURSIVE-INFERENCE"
      ]
    },
    {
      "route_id": "V82-ROUTE-DELEGATION-REPRESENTATION",
      "task": "分开代表主张、实际代行、委托有效性与 J 轴权限转移。",
      "source_anchors": [
        "V82-P0952",
        "V82-P0953",
        "V82-P0954"
      ],
      "concept_ids": [
        "V82-M07"
      ],
      "contract_ids": [
        "V82-CONTRACT-TRANSFORMATION",
        "V82-CONTRACT-JUDGMENT-GOVERNANCE"
      ]
    },
    {
      "route_id": "V82-ROUTE-COMPRESSION-ABSTRACTION",
      "task": "审计多对一表示中的来源、误差、不可恢复信息、缺失身份与行动上限。",
      "source_anchors": [
        "V82-P0955",
        "V82-P0956"
      ],
      "concept_ids": [
        "V82-M08"
      ],
      "contract_ids": [
        "V82-CONTRACT-CORE-KERNEL",
        "V82-CONTRACT-TRANSFORMATION",
        "V82-CONTRACT-JUDGMENT-GOVERNANCE"
      ]
    },
    {
      "route_id": "V82-ROUTE-LATERAL-TRANSFER",
      "task": "把跨领域类比限制为目标候选，并要求独立目标证据与授权。",
      "source_anchors": [
        "V82-P0957",
        "V82-P0958"
      ],
      "concept_ids": [
        "V82-M09"
      ],
      "contract_ids": [
        "V82-CONTRACT-TRANSFORMATION",
        "V82-CONTRACT-JUDGMENT-GOVERNANCE"
      ]
    }
  ]
}
